<?xml version="1.0"?>
<!DOCTYPE Report
[
<!ELEMENT Report (General ,(Doc|BPT)) >
<!ATTLIST Report ver CDATA #REQUIRED tmZone CDATA #REQUIRED>

<!ELEMENT General ( DocLocation ) >
<!ATTLIST General productName CDATA #REQUIRED productVer CDATA #REQUIRED os CDATA #REQUIRED host CDATA #REQUIRED qcserver CDATA #IMPLIED qcproject CDATA #IMPLIED SolManSolutionId CDATA #IMPLIED SolManProjectId CDATA #IMPLIED SolManTestPlanId CDATA #IMPLIED SolManTestPackageId CDATA #IMPLIED SolManUserInfoData CDATA #IMPLIED  >

<!ELEMENT BPT (DName,Res,DVer?,TSet?,TInst?,NodeArgs,AdditionalInfo*,Doc*) >
<!ATTLIST BPT rID ID #REQUIRED >

<!ELEMENT Doc (DName,ConfName?,Res,DVer?,TSet?,TInst?,RunType?,DT?,AdditionalInfo*,Step*,DIter*,Step*,Action*,Doc*,Summary?,TestMaintenanceSummary*,NodeArgs?) >
<!ATTLIST Doc rID ID #REQUIRED type (Test|BC|BPTWrapperTest|Flow|Group|Action) "Test" productName CDATA #REQUIRED BCIter CDATA #IMPLIED >

<!ELEMENT RunType ( #PCDATA )>
<!ATTLIST RunType fmStep (False|True) "False" batch (False|True) "False" upDesc (False|True) "False" upChk (False|True) "False" upAS (False|True) "False">

<!ELEMENT DName ( #PCDATA ) >

<!ELEMENT ConfName ( #PCDATA ) >

<!ELEMENT Res ( #PCDATA ) >

<!ELEMENT AdditionalInfo (AdditionalDataName,AdditionalDataValue ) >

<!ELEMENT AdditionalDataName ( #PCDATA ) >

<!ELEMENT AdditionalDataValue ( #PCDATA ) >

<!ELEMENT DVer ( #PCDATA ) >

<!ELEMENT TSet ( #PCDATA ) >

<!ELEMENT TInst ( #PCDATA ) >

<!ELEMENT DIter (Step*,Action+,Summary?,NodeArgs)>
<!ATTLIST DIter rID ID #REQUIRED iterID CDATA #REQUIRED>

<!ELEMENT DocLocation ( #PCDATA )>

<!ELEMENT Action (AName,AIter*,(Step|HtmlStep|Action)*, Summary,ActionMaintenanceSummary*, NodeArgs ) >
<!ATTLIST Action rID ID #REQUIRED>

<!ELEMENT AIter ((Step|HtmlStep|Action)*,DataMapping?, Summary?,NodeArgs) >
<!ATTLIST AIter rID ID #REQUIRED iterID CDATA #REQUIRED isCountable (False|True) "False" >

<!ELEMENT AName ( #PCDATA ) >

<!ELEMENT TestMaintenanceSummary (ActionMaintenanceSummary*) >
<!ATTLIST TestMaintenanceSummary ObjectsAdded CDATA #REQUIRED ObjectsUpdated CDATA #REQUIRED StepsUpdated CDATA #REQUIRED StepsComments CDATA #REQUIRED><!ELEMENT ActionMaintenanceSummary (ObjectChange* ) >
<!ATTLIST ActionMaintenanceSummary Action CDATA #REQUIRED Objects CDATA #REQUIRED Updated CDATA #REQUIRED LinesTotal CDATA #REQUIRED Added CDATA #REQUIRED LinesUpdated CDATA #REQUIRED>

<!ELEMENT ObjectChange  (Hierarchy, PropertyChangeList* ) >
<!ATTLIST ObjectChange Operation CDATA #IMPLIED OriginalRepository CDATA #IMPLIED>

<!ELEMENT PropertyChangeList (PropertyDef*) >

<!ELEMENT PropertyDef (OriginalValue, NewValue) >
<!ATTLIST PropertyDef PropName CDATA #REQUIRED OriginRegularExpression (True|False) "False" NewRegularExpression (True|False) "False" AddedProperty (True|False) "False" >

<!ELEMENT OriginalValue ( #PCDATA )>

<!ELEMENT NewValue ( #PCDATA )>

<!ELEMENT Hierarchy  (ObjectName, Hierarchy*) >
<!ATTLIST Hierarchy MicClass CDATA #REQUIRED>

<!ELEMENT ObjectName  ( #PCDATA ) >

<!ELEMENT Step (Obj,Details,Time,TimeTick* ,(Step|HtmlStep|Doc)*, DataMapping?, NodeArgs) >
<!ATTLIST Step rID ID #REQUIRED retval CDATA #IMPLIED>

<!ELEMENT HtmlStep (HTML,TimeTick*,(Step|HtmlStep|Doc)*,NodeArgs) >
<!ATTLIST HtmlStep rID ID #REQUIRED >

<!ELEMENT Obj ( #PCDATA ) >
<!ATTLIST Obj plainTxt (False|True) "True">

<!ELEMENT Details ( #PCDATA ) >
<!ATTLIST Details plainTxt (False|True) "True">

<!ELEMENT Time ( #PCDATA ) >

<!ELEMENT HTML ( #PCDATA ) >

<!ELEMENT Disp ( #PCDATA ) >

<!ELEMENT TimeTick ( #PCDATA ) >

<!ELEMENT DataMapping ( DataMappedItem* )>
<!ELEMENT DataMappedItem EMPTY >
<!ATTLIST DataMappedItem dsName CDATA #REQUIRED >
<!ATTLIST DataMappedItem rowId CDATA #REQUIRED >

<!ELEMENT NodeArgs (Disp,TopPane?,BtmPane?,ExtendedInfo? )>
<!ATTLIST NodeArgs eType CDATA #REQUIRED icon CDATA #REQUIRED nRep CDATA #REQUIRED UserNote CDATA #IMPLIED filter (False|True) "True">
<!ATTLIST NodeArgs status (Passed|Failed|Done|Warning|Information) "Done">
<!ATTLIST NodeArgs iconSel CDATA #IMPLIED nType CDATA #IMPLIED MovieMarker CDATA "">
<!ATTLIST NodeArgs Source CDATA #IMPLIED SourceLine CDATA #IMPLIED StepFlowItemKey CDATA #IMPLIED >

<!ELEMENT TopPane (Path)>

<!ELEMENT BtmPane ( (Path|WR)?,ASHilite?)>
<!ATTLIST BtmPane vType CDATA "HTML">

<!ELEMENT Path ( #PCDATA ) >

<!ELEMENT ASHilite ( #PCDATA ) >

<!ELEMENT WR ( #PCDATA ) >

<!ELEMENT ExtendedInfo ( StepData ) >

<!ATTLIST ExtendedInfo StepType CDATA #REQUIRED>
<!ELEMENT DT (NodeArgs) >
<!ATTLIST DT rID ID #REQUIRED>

<!ELEMENT Summary (Param*)>
<!ATTLIST Summary sTime CDATA #IMPLIED eTime CDATA #IMPLIED passed CDATA #IMPLIED failed CDATA #IMPLIED warnings CDATA #IMPLIED retval CDATA #IMPLIED stopped (False|True) "False" >

<!ELEMENT Param (ParamName,ParamVal)+ >
<!ATTLIST Param paramInOut (In|Out) "In">

<!ELEMENT ParamName ( #PCDATA ) >

<!ELEMENT ParamVal ( #PCDATA ) >

]
>
<Report ver="2.0" tmZone="India Standard Time">
<General productName="OpenText UFT One" productVer="24.2" os="Windows 11" host="IBM-68H9R24"><DocLocation><![CDATA[C:\Users\BanuchandhiranM\Downloads\POSRegression_Latest (2)\POS_FilePathValidation]]></DocLocation></General>
<Doc rID="T1"   productName= "OpenText UFT One"  >
<DName><![CDATA[POS_FilePathValidation]]></DName>
<Res><![CDATA[Res22]]></Res>
<DT rID="T2">
<NodeArgs eType="Table" icon="2" nRep="4" filter="False" >
<Disp><![CDATA[Run-Time Data Table]]></Disp>
<BtmPane vType="Table" >
<Path><![CDATA[Default.xlsx]]></Path>
</BtmPane>
</NodeArgs>
</DT>
<Step rID="T3">
<Obj plainTxt="False" ><![CDATA[Add-in(s) not activated]]></Obj>
<Details plainTxt="False" ><![CDATA[The following add-in(s) were associated with your test, but are not currently loaded: 
UIA.]]></Details>
<Time><![CDATA[16-06-2026 - 04:34:33]]></Time>
<TimeTick>1781564673</TimeTick>
<NodeArgs eType="Replay" icon="0" nRep="5" status="Warning" >
<Disp><![CDATA[Add-in(s) not activated]]></Disp>
</NodeArgs>
</Step>
<DIter rID="T4" iterID="1" >
<Action rID="T5">
<AName><![CDATA[Action1]]></AName>
<Step rID="T6">
<Obj plainTxt="False" ><![CDATA[AIUtil.SetContext]]></Obj>
<Details plainTxt="False" ><![CDATA[Set context Window("[ IBM Endpoint Manager for Remote Control ]") for AIUtil]]></Details>
<Time><![CDATA[16-06-2026 - 04:34:47]]></Time>
<TimeTick>1781564687</TimeTick>
<NodeArgs eType="Replay" icon="0" nRep="9" nType="AIUtil" Source="Action1" SourceLine="24" >
<Disp><![CDATA[AIUtil.SetContext]]></Disp>
</NodeArgs>
</Step>
<Step rID="T7">
<Obj ><![CDATA[Login Loaded]]></Obj>
<Details ><![CDATA[US90L01-09956]]></Details>
<Time><![CDATA[16-06-2026 - 04:34:52]]></Time>
<TimeTick>1781564692</TimeTick>
<NodeArgs eType="User" icon="5" nRep="10" Source="Action1" SourceLine="84" >
<Disp><![CDATA[Login Loaded]]></Disp>
</NodeArgs>
</Step>
<Step rID="T8">
<Obj plainTxt="False" ><![CDATA[AIUtil("down_triangle", micAnyText, micFromTop, 1).Click]]></Obj>
<Details plainTxt="False" ><![CDATA[]]></Details>
<Time><![CDATA[16-06-2026 - 04:34:54]]></Time>
<TimeTick>1781564694</TimeTick>
<NodeArgs eType="Replay" icon="6" nRep="12" Source="Action1" SourceLine="94" >
<Disp><![CDATA[AIUtil("down_triangle", micAnyText, micFromTop, 1).Click]]></Disp>
<BtmPane vType="ViewerGen.SSViewerGen" >
<Path><![CDATA[ZIP::Act1\Row0\ssf17.xml]]></Path>
<ASHilite><![CDATA[-1]]></ASHilite>
</BtmPane>
</NodeArgs>
</Step>
<Step rID="T9">
<Obj plainTxt="False" ><![CDATA[AIUtil("down_triangle", micAnyText, micFromTop, 1).Click]]></Obj>
<Details plainTxt="False" ><![CDATA[]]></Details>
<Time><![CDATA[16-06-2026 - 04:34:57]]></Time>
<TimeTick>1781564697</TimeTick>
<NodeArgs eType="Replay" icon="6" nRep="14" Source="Action1" SourceLine="98" >
<Disp><![CDATA[AIUtil("down_triangle", micAnyText, micFromTop, 1).Click]]></Disp>
<BtmPane vType="ViewerGen.SSViewerGen" >
<Path><![CDATA[ZIP::Act1\Row0\ssf18.xml]]></Path>
<ASHilite><![CDATA[-1]]></ASHilite>
</BtmPane>
</NodeArgs>
</Step>
<Step rID="T10">
<Obj plainTxt="False" ><![CDATA[AIUtil("text_box", "Address").RightClick]]></Obj>
<Details plainTxt="False" ><![CDATA[]]></Details>
<Time><![CDATA[16-06-2026 - 04:34:58]]></Time>
<TimeTick>1781564698</TimeTick>
<NodeArgs eType="Replay" icon="6" nRep="16" Source="Action1" SourceLine="100" >
<Disp><![CDATA[AIUtil("text_box", "Address").RightClick]]></Disp>
<BtmPane vType="ViewerGen.SSViewerGen" >
<Path><![CDATA[ZIP::Act1\Row0\ssf19.xml]]></Path>
<ASHilite><![CDATA[-1]]></ASHilite>
</BtmPane>
</NodeArgs>
</Step>
<Step rID="T11">
<Obj plainTxt="False" ><![CDATA[AIUtil("text_box", "Address").Type]]></Obj>
<Details plainTxt="False" ><![CDATA["US90L01-09956"]]></Details>
<Time><![CDATA[16-06-2026 - 04:35:04]]></Time>
<TimeTick>1781564704</TimeTick>
<NodeArgs eType="Replay" icon="6" nRep="18" Source="Action1" SourceLine="110" >
<Disp><![CDATA[AIUtil("text_box", "Address").Type]]></Disp>
<BtmPane vType="ViewerGen.SSViewerGen" >
<Path><![CDATA[ZIP::Act1\Row0\ssf20.xml]]></Path>
<ASHilite><![CDATA[-1]]></ASHilite>
</BtmPane>
</NodeArgs>
</Step>
<Step rID="T12">
<Obj ><![CDATA[Lane Address]]></Obj>
<Details ><![CDATA[US90L01-09956]]></Details>
<Time><![CDATA[16-06-2026 - 04:35:05]]></Time>
<TimeTick>1781564705</TimeTick>
<NodeArgs eType="User" icon="5" nRep="19" Source="Action1" SourceLine="112" >
<Disp><![CDATA[Lane Address]]></Disp>
</NodeArgs>
</Step>
<Step rID="T13">
<Obj plainTxt="False" ><![CDATA[AIUtil("button", "Active")]]></Obj>
<Details plainTxt="False" ><![CDATA[Verifying object identification failed. The object was no longer identified when performing the operation. 
The step was performed but might not have the expected results.]]></Details>
<Time><![CDATA[16-06-2026 - 04:35:17]]></Time>
<TimeTick>1781564717</TimeTick>
<NodeArgs eType="Replay" icon="6" nRep="20" status="Warning" Source="Action1" SourceLine="114" >
<Disp><![CDATA[AIUtil("button", "Active")]]></Disp>
<BtmPane vType="ViewerGen.SSViewerGen" >
<Path><![CDATA[ZIP::Act1\Row0\ssf21.xml]]></Path>
<ASHilite><![CDATA[-1]]></ASHilite>
</BtmPane>
</NodeArgs>
</Step>
<Step rID="T14">
<Obj plainTxt="False" ><![CDATA[AIUtil("button", "Active").Click]]></Obj>
<Details plainTxt="False" ><![CDATA[]]></Details>
<Time><![CDATA[16-06-2026 - 04:35:18]]></Time>
<TimeTick>1781564718</TimeTick>
<NodeArgs eType="Replay" icon="6" nRep="22" Source="Action1" SourceLine="114" >
<Disp><![CDATA[AIUtil("button", "Active").Click]]></Disp>
<BtmPane vType="ViewerGen.SSViewerGen" >
<Path><![CDATA[ZIP::Act1\Row0\ssf22.xml]]></Path>
<ASHilite><![CDATA[-1]]></ASHilite>
</BtmPane>
</NodeArgs>
</Step>
<Step rID="T15">
<Obj plainTxt="False" ><![CDATA[AIUtil("combobox", "User ID").Type]]></Obj>
<Details plainTxt="False" ><![CDATA["vn44q8d"]]></Details>
<Time><![CDATA[16-06-2026 - 04:35:26]]></Time>
<TimeTick>1781564726</TimeTick>
<NodeArgs eType="Replay" icon="6" nRep="24" Source="Action1" SourceLine="126" >
<Disp><![CDATA[AIUtil("combobox", "User ID").Type]]></Disp>
<BtmPane vType="ViewerGen.SSViewerGen" >
<Path><![CDATA[ZIP::Act1\Row0\ssf23.xml]]></Path>
<ASHilite><![CDATA[-1]]></ASHilite>
</BtmPane>
</NodeArgs>
</Step>
<Step rID="T16">
<Obj plainTxt="False" ><![CDATA[AIUtil("text_box", "Password").Type]]></Obj>
<Details plainTxt="False" ><![CDATA["Chi@1998"]]></Details>
<Time><![CDATA[16-06-2026 - 04:35:28]]></Time>
<TimeTick>1781564728</TimeTick>
<NodeArgs eType="Replay" icon="6" nRep="26" Source="Action1" SourceLine="128" >
<Disp><![CDATA[AIUtil("text_box", "Password").Type]]></Disp>
<BtmPane vType="ViewerGen.SSViewerGen" >
<Path><![CDATA[ZIP::Act1\Row0\ssf24.xml]]></Path>
<ASHilite><![CDATA[-1]]></ASHilite>
</BtmPane>
</NodeArgs>
</Step>
<Step rID="T17">
<Obj plainTxt="False" ><![CDATA[AIUtil("combobox", "Domain").Click]]></Obj>
<Details plainTxt="False" ><![CDATA[]]></Details>
<Time><![CDATA[16-06-2026 - 04:35:30]]></Time>
<TimeTick>1781564730</TimeTick>
<NodeArgs eType="Replay" icon="6" nRep="28" Source="Action1" SourceLine="130" >
<Disp><![CDATA[AIUtil("combobox", "Domain").Click]]></Disp>
<BtmPane vType="ViewerGen.SSViewerGen" >
<Path><![CDATA[ZIP::Act1\Row0\ssf25.xml]]></Path>
<ASHilite><![CDATA[-1]]></ASHilite>
</BtmPane>
</NodeArgs>
</Step>
<Step rID="T18">
<Obj plainTxt="False" ><![CDATA[AIUtil("button", "Login").Click]]></Obj>
<Details plainTxt="False" ><![CDATA[]]></Details>
<Time><![CDATA[16-06-2026 - 04:35:39]]></Time>
<TimeTick>1781564739</TimeTick>
<NodeArgs eType="Replay" icon="6" nRep="30" Source="Action1" SourceLine="142" >
<Disp><![CDATA[AIUtil("button", "Login").Click]]></Disp>
<BtmPane vType="ViewerGen.SSViewerGen" >
<Path><![CDATA[ZIP::Act1\Row0\ssf26.xml]]></Path>
<ASHilite><![CDATA[-1]]></ASHilite>
</BtmPane>
</NodeArgs>
</Step>
<Step rID="T19">
<Obj ><![CDATA[Total Active Files to Test]]></Obj>
<Details ><![CDATA[22]]></Details>
<Time><![CDATA[16-06-2026 - 04:35:47]]></Time>
<TimeTick>1781564747</TimeTick>
<NodeArgs eType="User" icon="5" nRep="31" Source="Action1" SourceLine="176" >
<Disp><![CDATA[Total Active Files to Test]]></Disp>
</NodeArgs>
</Step>
<Step rID="T20">
<Obj plainTxt="False" ><![CDATA[[ IBM Endpoint Manager for Remote Control  (US90L01-09956)  ].Activate]]></Obj>
<Details plainTxt="False" ><![CDATA[]]></Details>
<Time><![CDATA[16-06-2026 - 04:35:47]]></Time>
<TimeTick>1781564747</TimeTick>
<NodeArgs eType="Replay" icon="7" nRep="33" Source="Action1" SourceLine="183" >
<Disp><![CDATA[[ IBM Endpoint Manager for Remote Control  (US90L01-09956)  ].Activate]]></Disp>
<BtmPane vType="ViewerGen.SSViewerGen" >
<Path><![CDATA[ZIP::Act1\Row0\ssf27.xml]]></Path>
<ASHilite><![CDATA[1640562]]></ASHilite>
</BtmPane>
</NodeArgs>
</Step>
<Step rID="T21">
<Obj plainTxt="False" ><![CDATA[[ IBM Endpoint Manager for Remote Control  (US90L01-09956)  ].Click]]></Obj>
<Details plainTxt="False" ><![CDATA[332, 10]]></Details>
<Time><![CDATA[16-06-2026 - 04:35:49]]></Time>
<TimeTick>1781564749</TimeTick>
<NodeArgs eType="Replay" icon="7" nRep="35" Source="Action1" SourceLine="187" >
<Disp><![CDATA[[ IBM Endpoint Manager for Remote Control  (US90L01-09956)  ].Click]]></Disp>
<BtmPane vType="ViewerGen.SSViewerGen" >
<Path><![CDATA[ZIP::Act1\Row0\ssf28.xml]]></Path>
<ASHilite><![CDATA[1640562]]></ASHilite>
</BtmPane>
</NodeArgs>
</Step>
<Step rID="T22">
<Obj plainTxt="False" ><![CDATA[AIUtil.FindTextBlock("Task Manager").Click]]></Obj>
<Details plainTxt="False" ><![CDATA[]]></Details>
<Time><![CDATA[16-06-2026 - 04:36:01]]></Time>
<TimeTick>1781564761</TimeTick>
<NodeArgs eType="Replay" icon="6" nRep="37" Source="Action1" SourceLine="203" >
<Disp><![CDATA[AIUtil.FindTextBlock("Task Manager").Click]]></Disp>
<BtmPane vType="ViewerGen.SSViewerGen" >
<Path><![CDATA[ZIP::Act1\Row0\ssf29.xml]]></Path>
<ASHilite><![CDATA[-1]]></ASHilite>
</BtmPane>
</NodeArgs>
</Step>
<Step rID="T23">
<Obj plainTxt="False" ><![CDATA[AIUtil.FindTextBlock("File").Click]]></Obj>
<Details plainTxt="False" ><![CDATA[]]></Details>
<Time><![CDATA[16-06-2026 - 04:36:05]]></Time>
<TimeTick>1781564765</TimeTick>
<NodeArgs eType="Replay" icon="6" nRep="39" Source="Action1" SourceLine="207" >
<Disp><![CDATA[AIUtil.FindTextBlock("File").Click]]></Disp>
<BtmPane vType="ViewerGen.SSViewerGen" >
<Path><![CDATA[ZIP::Act1\Row0\ssf30.xml]]></Path>
<ASHilite><![CDATA[-1]]></ASHilite>
</BtmPane>
</NodeArgs>
</Step>
<Step rID="T24">
<Obj ><![CDATA[Checking File]]></Obj>
<Details ><![CDATA[Certstorage]]></Details>
<Time><![CDATA[16-06-2026 - 04:36:12]]></Time>
<TimeTick>1781564772</TimeTick>
<NodeArgs eType="User" icon="5" nRep="40" Source="Action1" SourceLine="228" >
<Disp><![CDATA[Checking File]]></Disp>
</NodeArgs>
</Step>
<Step rID="T25">
<Obj ><![CDATA[FILE FOUND]]></Obj>
<Details ><![CDATA[Certstorage]]></Details>
<Time><![CDATA[16-06-2026 - 04:36:37]]></Time>
<TimeTick>1781564797</TimeTick>
<NodeArgs eType="User" icon="5" nRep="41" Source="Action1" SourceLine="292" >
<Disp><![CDATA[FILE FOUND]]></Disp>
</NodeArgs>
</Step>
<Step rID="T26">
<Obj ><![CDATA[Checking File]]></Obj>
<Details ><![CDATA[fl_lane8000.zip]]></Details>
<Time><![CDATA[16-06-2026 - 04:36:39]]></Time>
<TimeTick>1781564799</TimeTick>
<NodeArgs eType="User" icon="5" nRep="42" Source="Action1" SourceLine="228" >
<Disp><![CDATA[Checking File]]></Disp>
</NodeArgs>
</Step>
<Step rID="T27">
<Obj ><![CDATA[FILE FOUND]]></Obj>
<Details ><![CDATA[fl_lane8000.zip]]></Details>
<Time><![CDATA[16-06-2026 - 04:37:04]]></Time>
<TimeTick>1781564824</TimeTick>
<NodeArgs eType="User" icon="5" nRep="43" Source="Action1" SourceLine="292" >
<Disp><![CDATA[FILE FOUND]]></Disp>
</NodeArgs>
</Step>
<Step rID="T28">
<Obj ><![CDATA[Checking File]]></Obj>
<Details ><![CDATA[fl_link2500.zip]]></Details>
<Time><![CDATA[16-06-2026 - 04:37:07]]></Time>
<TimeTick>1781564827</TimeTick>
<NodeArgs eType="User" icon="5" nRep="44" Source="Action1" SourceLine="228" >
<Disp><![CDATA[Checking File]]></Disp>
</NodeArgs>
</Step>
<Step rID="T29">
<Obj ><![CDATA[FILE FOUND]]></Obj>
<Details ><![CDATA[fl_link2500.zip]]></Details>
<Time><![CDATA[16-06-2026 - 04:37:32]]></Time>
<TimeTick>1781564852</TimeTick>
<NodeArgs eType="User" icon="5" nRep="45" Source="Action1" SourceLine="292" >
<Disp><![CDATA[FILE FOUND]]></Disp>
</NodeArgs>
</Step>
<Step rID="T30">
<Obj ><![CDATA[Checking File]]></Obj>
<Details ><![CDATA[hbc_lane8000.zip]]></Details>
<Time><![CDATA[16-06-2026 - 04:37:34]]></Time>
<TimeTick>1781564854</TimeTick>
<NodeArgs eType="User" icon="5" nRep="46" Source="Action1" SourceLine="228" >
<Disp><![CDATA[Checking File]]></Disp>
</NodeArgs>
</Step>
<Step rID="T31">
<Obj ><![CDATA[FILE MISSING]]></Obj>
<Details ><![CDATA[hbc_lane8000.zip]]></Details>
<Time><![CDATA[16-06-2026 - 04:37:59]]></Time>
<TimeTick>1781564879</TimeTick>
<NodeArgs eType="User" icon="5" nRep="47" status="Failed" Source="Action1" SourceLine="287" >
<Disp><![CDATA[FILE MISSING]]></Disp>
</NodeArgs>
</Step>
<Step rID="T32">
<Obj ><![CDATA[Checking File]]></Obj>
<Details ><![CDATA[hbc_link2500.zip]]></Details>
<Time><![CDATA[16-06-2026 - 04:38:02]]></Time>
<TimeTick>1781564882</TimeTick>
<NodeArgs eType="User" icon="5" nRep="48" Source="Action1" SourceLine="228" >
<Disp><![CDATA[Checking File]]></Disp>
</NodeArgs>
</Step>
<Step rID="T33">
<Obj ><![CDATA[FILE MISSING]]></Obj>
<Details ><![CDATA[hbc_link2500.zip]]></Details>
<Time><![CDATA[16-06-2026 - 04:38:27]]></Time>
<TimeTick>1781564907</TimeTick>
<NodeArgs eType="User" icon="5" nRep="49" status="Failed" Source="Action1" SourceLine="287" >
<Disp><![CDATA[FILE MISSING]]></Disp>
</NodeArgs>
</Step>
<Step rID="T34">
<Obj ><![CDATA[Checking File]]></Obj>
<Details ><![CDATA[ind_lane8000.zip]]></Details>
<Time><![CDATA[16-06-2026 - 04:38:30]]></Time>
<TimeTick>1781564910</TimeTick>
<NodeArgs eType="User" icon="5" nRep="50" Source="Action1" SourceLine="228" >
<Disp><![CDATA[Checking File]]></Disp>
</NodeArgs>
</Step>
<Step rID="T35">
<Obj ><![CDATA[FILE MISSING]]></Obj>
<Details ><![CDATA[ind_lane8000.zip]]></Details>
<Time><![CDATA[16-06-2026 - 04:38:52]]></Time>
<TimeTick>1781564932</TimeTick>
<NodeArgs eType="User" icon="5" nRep="51" status="Failed" Source="Action1" SourceLine="287" >
<Disp><![CDATA[FILE MISSING]]></Disp>
</NodeArgs>
</Step>
<Step rID="T36">
<Obj ><![CDATA[Checking File]]></Obj>
<Details ><![CDATA[mtx_eps.dll]]></Details>
<Time><![CDATA[16-06-2026 - 04:38:55]]></Time>
<TimeTick>1781564935</TimeTick>
<NodeArgs eType="User" icon="5" nRep="52" Source="Action1" SourceLine="228" >
<Disp><![CDATA[Checking File]]></Disp>
</NodeArgs>
</Step>
<Step rID="T37">
<Obj ><![CDATA[FILE FOUND]]></Obj>
<Details ><![CDATA[mtx_eps.dll]]></Details>
<Time><![CDATA[16-06-2026 - 04:39:20]]></Time>
<TimeTick>1781564960</TimeTick>
<NodeArgs eType="User" icon="5" nRep="53" Source="Action1" SourceLine="292" >
<Disp><![CDATA[FILE FOUND]]></Disp>
</NodeArgs>
</Step>
<Step rID="T38">
<Obj ><![CDATA[Checking File]]></Obj>
<Details ><![CDATA[mtx_eps.upd]]></Details>
<Time><![CDATA[16-06-2026 - 04:39:22]]></Time>
<TimeTick>1781564962</TimeTick>
<NodeArgs eType="User" icon="5" nRep="54" Source="Action1" SourceLine="228" >
<Disp><![CDATA[Checking File]]></Disp>
</NodeArgs>
</Step>
<Step rID="T39">
<Obj ><![CDATA[FILE FOUND]]></Obj>
<Details ><![CDATA[mtx_eps.upd]]></Details>
<Time><![CDATA[16-06-2026 - 04:39:45]]></Time>
<TimeTick>1781564985</TimeTick>
<NodeArgs eType="User" icon="5" nRep="55" Source="Action1" SourceLine="292" >
<Disp><![CDATA[FILE FOUND]]></Disp>
</NodeArgs>
</Step>
<Step rID="T40">
<Obj ><![CDATA[Checking File]]></Obj>
<Details ><![CDATA[Mtx_eps.dll]]></Details>
<Time><![CDATA[16-06-2026 - 04:39:47]]></Time>
<TimeTick>1781564987</TimeTick>
<NodeArgs eType="User" icon="5" nRep="56" Source="Action1" SourceLine="228" >
<Disp><![CDATA[Checking File]]></Disp>
</NodeArgs>
</Step>
<Step rID="T41">
<Obj ><![CDATA[FILE FOUND]]></Obj>
<Details ><![CDATA[Mtx_eps.dll]]></Details>
<Time><![CDATA[16-06-2026 - 04:40:10]]></Time>
<TimeTick>1781565010</TimeTick>
<NodeArgs eType="User" icon="5" nRep="57" Source="Action1" SourceLine="292" >
<Disp><![CDATA[FILE FOUND]]></Disp>
</NodeArgs>
</Step>
<Step rID="T42">
<Obj ><![CDATA[Checking File]]></Obj>
<Details ><![CDATA[Mtx_eps.upd]]></Details>
<Time><![CDATA[16-06-2026 - 04:40:12]]></Time>
<TimeTick>1781565012</TimeTick>
<NodeArgs eType="User" icon="5" nRep="58" Source="Action1" SourceLine="228" >
<Disp><![CDATA[Checking File]]></Disp>
</NodeArgs>
</Step>
<Step rID="T43">
<Obj ><![CDATA[FILE FOUND]]></Obj>
<Details ><![CDATA[Mtx_eps.upd]]></Details>
<Time><![CDATA[16-06-2026 - 04:40:35]]></Time>
<TimeTick>1781565035</TimeTick>
<NodeArgs eType="User" icon="5" nRep="59" Source="Action1" SourceLine="292" >
<Disp><![CDATA[FILE FOUND]]></Disp>
</NodeArgs>
</Step>
<Step rID="T44">
<Obj ><![CDATA[Checking File]]></Obj>
<Details ><![CDATA[EMVCONTACT.XML]]></Details>
<Time><![CDATA[16-06-2026 - 04:40:37]]></Time>
<TimeTick>1781565037</TimeTick>
<NodeArgs eType="User" icon="5" nRep="60" Source="Action1" SourceLine="228" >
<Disp><![CDATA[Checking File]]></Disp>
</NodeArgs>
</Step>
<Step rID="T45">
<Obj ><![CDATA[FILE FOUND]]></Obj>
<Details ><![CDATA[EMVCONTACT.XML]]></Details>
<Time><![CDATA[16-06-2026 - 04:41:02]]></Time>
<TimeTick>1781565062</TimeTick>
<NodeArgs eType="User" icon="5" nRep="61" Source="Action1" SourceLine="292" >
<Disp><![CDATA[FILE FOUND]]></Disp>
</NodeArgs>
</Step>
<Step rID="T46">
<Obj ><![CDATA[Checking File]]></Obj>
<Details ><![CDATA[args_getmx925vers.xml]]></Details>
<Time><![CDATA[16-06-2026 - 04:41:05]]></Time>
<TimeTick>1781565065</TimeTick>
<NodeArgs eType="User" icon="5" nRep="62" Source="Action1" SourceLine="228" >
<Disp><![CDATA[Checking File]]></Disp>
</NodeArgs>
</Step>
<Step rID="T47">
<Obj ><![CDATA[FILE FOUND]]></Obj>
<Details ><![CDATA[args_getmx925vers.xml]]></Details>
<Time><![CDATA[16-06-2026 - 04:41:27]]></Time>
<TimeTick>1781565087</TimeTick>
<NodeArgs eType="User" icon="5" nRep="63" Source="Action1" SourceLine="292" >
<Disp><![CDATA[FILE FOUND]]></Disp>
</NodeArgs>
</Step>
<Step rID="T48">
<Obj ><![CDATA[Checking File]]></Obj>
<Details ><![CDATA[clsFormAgent.dll]]></Details>
<Time><![CDATA[16-06-2026 - 04:41:29]]></Time>
<TimeTick>1781565089</TimeTick>
<NodeArgs eType="User" icon="5" nRep="64" Source="Action1" SourceLine="228" >
<Disp><![CDATA[Checking File]]></Disp>
</NodeArgs>
</Step>
<Step rID="T49">
<Obj ><![CDATA[FILE FOUND]]></Obj>
<Details ><![CDATA[clsFormAgent.dll]]></Details>
<Time><![CDATA[16-06-2026 - 04:41:52]]></Time>
<TimeTick>1781565112</TimeTick>
<NodeArgs eType="User" icon="5" nRep="65" Source="Action1" SourceLine="292" >
<Disp><![CDATA[FILE FOUND]]></Disp>
</NodeArgs>
</Step>
<Step rID="T50">
<Obj ><![CDATA[Checking File]]></Obj>
<Details ><![CDATA[DDL.EXE]]></Details>
<Time><![CDATA[16-06-2026 - 04:41:54]]></Time>
<TimeTick>1781565114</TimeTick>
<NodeArgs eType="User" icon="5" nRep="66" Source="Action1" SourceLine="228" >
<Disp><![CDATA[Checking File]]></Disp>
</NodeArgs>
</Step>
<Step rID="T51">
<Obj ><![CDATA[FILE FOUND]]></Obj>
<Details ><![CDATA[DDL.EXE]]></Details>
<Time><![CDATA[16-06-2026 - 04:42:19]]></Time>
<TimeTick>1781565139</TimeTick>
<NodeArgs eType="User" icon="5" nRep="67" Source="Action1" SourceLine="292" >
<Disp><![CDATA[FILE FOUND]]></Disp>
</NodeArgs>
</Step>
<Step rID="T52">
<Obj ><![CDATA[Checking File]]></Obj>
<Details ><![CDATA[DDL_1.6B4.EXE]]></Details>
<Time><![CDATA[16-06-2026 - 04:42:21]]></Time>
<TimeTick>1781565141</TimeTick>
<NodeArgs eType="User" icon="5" nRep="68" Source="Action1" SourceLine="228" >
<Disp><![CDATA[Checking File]]></Disp>
</NodeArgs>
</Step>
<Step rID="T53">
<Obj ><![CDATA[FILE FOUND]]></Obj>
<Details ><![CDATA[DDL_1.6B4.EXE]]></Details>
<Time><![CDATA[16-06-2026 - 04:42:47]]></Time>
<TimeTick>1781565167</TimeTick>
<NodeArgs eType="User" icon="5" nRep="69" Source="Action1" SourceLine="292" >
<Disp><![CDATA[FILE FOUND]]></Disp>
</NodeArgs>
</Step>
<Step rID="T54">
<Obj ><![CDATA[Checking File]]></Obj>
<Details ><![CDATA[EMVCTLSCONFIG-211213.tgz]]></Details>
<Time><![CDATA[16-06-2026 - 04:42:49]]></Time>
<TimeTick>1781565169</TimeTick>
<NodeArgs eType="User" icon="5" nRep="70" Source="Action1" SourceLine="228" >
<Disp><![CDATA[Checking File]]></Disp>
</NodeArgs>
</Step>
<Step rID="T55">
<Obj ><![CDATA[FILE FOUND]]></Obj>
<Details ><![CDATA[EMVCTLSCONFIG-211213.tgz]]></Details>
<Time><![CDATA[16-06-2026 - 04:43:14]]></Time>
<TimeTick>1781565194</TimeTick>
<NodeArgs eType="User" icon="5" nRep="71" Source="Action1" SourceLine="292" >
<Disp><![CDATA[FILE FOUND]]></Disp>
</NodeArgs>
</Step>
<Step rID="T56">
<Obj ><![CDATA[Checking File]]></Obj>
<Details ><![CDATA[fl_mx925.zip]]></Details>
<Time><![CDATA[16-06-2026 - 04:43:16]]></Time>
<TimeTick>1781565196</TimeTick>
<NodeArgs eType="User" icon="5" nRep="72" Source="Action1" SourceLine="228" >
<Disp><![CDATA[Checking File]]></Disp>
</NodeArgs>
</Step>
<Step rID="T57">
<Obj ><![CDATA[FILE FOUND]]></Obj>
<Details ><![CDATA[fl_mx925.zip]]></Details>
<Time><![CDATA[16-06-2026 - 04:43:39]]></Time>
<TimeTick>1781565219</TimeTick>
<NodeArgs eType="User" icon="5" nRep="73" Source="Action1" SourceLine="292" >
<Disp><![CDATA[FILE FOUND]]></Disp>
</NodeArgs>
</Step>
<Step rID="T58">
<Obj ><![CDATA[Checking File]]></Obj>
<Details ><![CDATA[hbc_mx925.zip]]></Details>
<Time><![CDATA[16-06-2026 - 04:43:41]]></Time>
<TimeTick>1781565221</TimeTick>
<NodeArgs eType="User" icon="5" nRep="74" Source="Action1" SourceLine="228" >
<Disp><![CDATA[Checking File]]></Disp>
</NodeArgs>
</Step>
<Step rID="T59">
<Obj ><![CDATA[FILE MISSING]]></Obj>
<Details ><![CDATA[hbc_mx925.zip]]></Details>
<Time><![CDATA[16-06-2026 - 04:44:04]]></Time>
<TimeTick>1781565244</TimeTick>
<NodeArgs eType="User" icon="5" nRep="75" status="Failed" Source="Action1" SourceLine="287" >
<Disp><![CDATA[FILE MISSING]]></Disp>
</NodeArgs>
</Step>
<Step rID="T60">
<Obj ><![CDATA[Checking File]]></Obj>
<Details ><![CDATA[ind_mx925.zip]]></Details>
<Time><![CDATA[16-06-2026 - 04:44:07]]></Time>
<TimeTick>1781565247</TimeTick>
<NodeArgs eType="User" icon="5" nRep="76" Source="Action1" SourceLine="228" >
<Disp><![CDATA[Checking File]]></Disp>
</NodeArgs>
</Step>
<Step rID="T61">
<Obj ><![CDATA[FILE MISSING]]></Obj>
<Details ><![CDATA[ind_mx925.zip]]></Details>
<Time><![CDATA[16-06-2026 - 04:44:30]]></Time>
<TimeTick>1781565270</TimeTick>
<NodeArgs eType="User" icon="5" nRep="77" status="Failed" Source="Action1" SourceLine="287" >
<Disp><![CDATA[FILE MISSING]]></Disp>
</NodeArgs>
</Step>
<Step rID="T62">
<Obj ><![CDATA[Checking File]]></Obj>
<Details ><![CDATA[NLog.dll]]></Details>
<Time><![CDATA[16-06-2026 - 04:44:33]]></Time>
<TimeTick>1781565273</TimeTick>
<NodeArgs eType="User" icon="5" nRep="78" Source="Action1" SourceLine="228" >
<Disp><![CDATA[Checking File]]></Disp>
</NodeArgs>
</Step>
<Step rID="T63">
<Obj ><![CDATA[FILE FOUND]]></Obj>
<Details ><![CDATA[NLog.dll]]></Details>
<Time><![CDATA[16-06-2026 - 04:44:55]]></Time>
<TimeTick>1781565295</TimeTick>
<NodeArgs eType="User" icon="5" nRep="79" Source="Action1" SourceLine="292" >
<Disp><![CDATA[FILE FOUND]]></Disp>
</NodeArgs>
</Step>
<Step rID="T64">
<Obj ><![CDATA[Checking File]]></Obj>
<Details ><![CDATA[VfIO.dll]]></Details>
<Time><![CDATA[16-06-2026 - 04:44:57]]></Time>
<TimeTick>1781565297</TimeTick>
<NodeArgs eType="User" icon="5" nRep="80" Source="Action1" SourceLine="228" >
<Disp><![CDATA[Checking File]]></Disp>
</NodeArgs>
</Step>
<Step rID="T65">
<Obj ><![CDATA[FILE FOUND]]></Obj>
<Details ><![CDATA[VfIO.dll]]></Details>
<Time><![CDATA[16-06-2026 - 04:45:20]]></Time>
<TimeTick>1781565320</TimeTick>
<NodeArgs eType="User" icon="5" nRep="81" Source="Action1" SourceLine="292" >
<Disp><![CDATA[FILE FOUND]]></Disp>
</NodeArgs>
</Step>
<Step rID="T66">
<Obj ><![CDATA[Checking File]]></Obj>
<Details ><![CDATA[VfQueryUpdate.exe]]></Details>
<Time><![CDATA[16-06-2026 - 04:45:22]]></Time>
<TimeTick>1781565322</TimeTick>
<NodeArgs eType="User" icon="5" nRep="82" Source="Action1" SourceLine="228" >
<Disp><![CDATA[Checking File]]></Disp>
</NodeArgs>
</Step>
<Step rID="T67">
<Obj ><![CDATA[FILE FOUND]]></Obj>
<Details ><![CDATA[VfQueryUpdate.exe]]></Details>
<Time><![CDATA[16-06-2026 - 04:45:45]]></Time>
<TimeTick>1781565345</TimeTick>
<NodeArgs eType="User" icon="5" nRep="83" Source="Action1" SourceLine="292" >
<Disp><![CDATA[FILE FOUND]]></Disp>
</NodeArgs>
</Step>
<Step rID="T68">
<Obj ><![CDATA[Excel Updated]]></Obj>
<Details ><![CDATA[Result written successfully]]></Details>
<Time><![CDATA[16-06-2026 - 04:45:58]]></Time>
<TimeTick>1781565358</TimeTick>
<NodeArgs eType="User" icon="5" nRep="84" Source="Action1" SourceLine="313" >
<Disp><![CDATA[Excel Updated]]></Disp>
</NodeArgs>
</Step>
<Step rID="T69">
<Obj plainTxt="False" ><![CDATA[AIUtil("close", micAnyText, micFromTop, 2).Click]]></Obj>
<Details plainTxt="False" ><![CDATA[]]></Details>
<Time><![CDATA[16-06-2026 - 04:45:59]]></Time>
<TimeTick>1781565359</TimeTick>
<NodeArgs eType="Replay" icon="6" nRep="86" Source="Action1" SourceLine="319" >
<Disp><![CDATA[AIUtil("close", micAnyText, micFromTop, 2).Click]]></Disp>
<BtmPane vType="ViewerGen.SSViewerGen" >
<Path><![CDATA[ZIP::Act1\Row0\ssf31.xml]]></Path>
<ASHilite><![CDATA[-1]]></ASHilite>
</BtmPane>
</NodeArgs>
</Step>
<Step rID="T70">